referenznummer,docNr,docTyp,docText
Wer sich zur Verfolgung politischer oder religiöser Ziele an Gewalttätigkeiten beteiligt oder zu Hass gegen Teile 
der Bevölkerung aufruft, verwirklicht ein besonders schweres Ausweisungsinteresse nach § 54 Absatz 1
Nummer 4 beziehungsweise Nummer 5 AufenthG. Damit bestanden zwar bereits rechtliche Möglichkeiten, um
aufenthaltsrechtlich gegen Ausländer vorgehen zu können, die an gewalttätigen Veranstaltungen, Versammlungen 
oder sonstigen Zusammenkünften teilnehmen. Das Gewicht einer strafrechtlichen Verurteilung war aber für diese 
Verhaltensweisen im Ausweisungsrecht nicht ausreichend abgebildet. 
Bislang führte lediglich die Verurteilung zu einer Freiheitsstrafe von mindestens zwei Jahren zu einem besonders 
schwerwiegenden Ausweisungsinteresse nach § 54 Absatz 1 Nummer 1 AufenthG. Die Teilnahme an den
beschriebenen gewalttätigen Ausschreitungen hat vermehrt zu Ermittlungsverfahren und Anklageerhebungen wegen 
Landfriedensbruch nach § 125 StGB beziehungsweise wegen schweren Landfriedensbruchs nach § 125a StGB 
geführt. Auch um solchen Straftaten entgegenzuwirken, ist hier in Zukunft ein generalpräventiver Ansatz auch 
für das Ausweisungsrecht zu wählen. Diese Straftaten gegen die öffentliche Sicherheit sind mit denjenigen, die 
bereits in § 54 Absatz 1 Nummer 1a AufenthG aufgenommen wurden und bei denen eine Verurteilung zu einer 
Freiheitstrafe von mindestens einem Jahr ausreicht, vergleichbar und deshalb gleichzusetzen. Damit reicht künftig 
auch bei Verurteilungen wegen § 125 StGB oder § 125a StGB bereits eine Freiheitstrafe von einem Jahr für ein 
besonders schwerwiegendes Ausweisungsinteresse. 
Zu Doppelbuchstabe bb 
Es handelt sich um eine Anpassung an § 54 Absatz 2 Nummer 3 AufenthG, der sowohl auf § 96 AufenthG als auf 
§ 97 AufenthG verweist. In minder schweren Fällen des Einschleusens mit Todesfolge beziehungsweise des
gewerbs- und bandenmäßigen Einschleusens gemäß § 97 Absatz 3 AufenthG liegt die Mindestfreiheitsstrafe nicht 
unter einem Jahr, so dass eine Aufnahme neben § 96 AufenthG in § 54 Absatz 1 Nummer 1c AufenthG notwendig 
ist. 
Zu Doppelbuchstabe cc 
Mit der Einführung des neuen § 54 Absatz 1 Nummer 1d AufenthG wird ein neuer Ausweisungstatbestand für 
den Fall geschaffen, dass einer der aufgeführten Straftatbestände unter Verwendung einer Waffe oder eines
anderen gefährlichen Werkzeugs begangen worden ist.
Dabei reicht wegen der konkreten Gefahr, die von der Verwendung einer Waffe oder eines anderen gefährlichen 
Werkzeugs mit Blick auf eine erhebliche Verletzung ausgeht, bereits eine Verurteilung zu einer Freiheitsstrafe zu 
sechs Monaten aus, um ein besonders schwerwiegendes Ausweisungsinteresse zu begründen. 
Da die Straftatbestände nur unter Verwendung wie bei § 250 Absatz 2 Nummer 1 StGB und nicht mittels einer 
Waffe oder eines anderen gefährlichen Werkzeugs wie bei § 224 Absatz 1 Nummer 2 StGB begangen worden 
sein müssen, reicht Kausalität oder Zurechnungszusammenhang zwischen dem Einsatz der Waffe
beziehungsweise des gefährlichen Werkzeugs und der Verwirklichung des jeweiligen Tatbestandes aus. So ist im Falle einer 
Körperverletzung nicht erforderlich, dass diese unmittelbar durch das von außen auf den Körper des Tatopfers 
einwirkende gefährliche Werkzeug verursacht wird. Verwendet wird eine Waffe oder ein gefährliches Werkzeug 
daher nicht nur, wenn damit Gewalt ausgeübt wird, sondern auch wenn sie als Drohmittel eingesetzt werden. 
Ein besonders schwerwiegendes Ausweisungsinteresse nach § 54 Absatz 1 Nummer 1d Buchstabe b AufenthG 
liegt daher vor, wenn beispielsweise auf die Reifen eines fahrenden PKW geschossen und der Fahrer durch einen 
dadurch verursachten Unfall verletzt wird. Das Gleiche gilt für die Bedrohung mit einer Waffe, wodurch ein 
Schock ausgelöst wird. Ein Fall des § 224 Absatz 1 Nummer 2 StGB liegt dann zwar nicht vor, sondern lediglich 
ein Fall des § 223 StGB. Da es sich bei einer Ausweisung um eine Maßnahme der Gefahrenabwehr und des 
Schutzes der öffentlichen Sicherheit und Ordnung handelt, ist diese Unterscheidung gerechtfertigt. 
Den Oberbegriff bildet das gefährliche Werkzeug, dementsprechend muss auch die Waffe im Einzelfall als
gefährliches Werkzeug angewendet werden. 
Als gefährliches Werkzeug gilt jeder Gegenstand, der nach seiner objektiven Beschaffenheit und der Art seiner 
konkreten Verwendung im Einzelfall geeignet ist, erhebliche Verletzungen zuzufügen. Es gilt insofern der gleiche 
Maßstab wie in § 224 Absatz 1 Nummer 2 und § 250 Absatz 2 Nummer 1 StGB. Hier wird von der
Rechtsprechung (z. B. BGH, Urteil vom 23.06.1999 – 3 StR 147-99 zur Verwendung eines Turnschuhs) die Gefährlichkeit 
des Werkzeugs unter Verzicht auf eine generelle Gefahreneignung allein verwendungsabhängig bestimmt, so dass 
es nur auf die konkrete Anwendung eines „gefährlichen“ oder „ungefährlichen“ Gegenstandes unter
Berücksichtigung der Umstände des Einzelfalles, z. B. der Konstitution des Opfers, des betroffenen Körperteils oder der 
Intensität des Werkzeugeinsatzes, ankommt, sofern mit der Anwendung die Gefahr einer erheblichen Verletzung 
verbunden ist. Ist das Werkzeug als Drohmittel eingesetzt worden, so ist darauf abzustellen, welches Übel der 
Täter mittels des gefährlichen Werkzeugs in Aussicht gestellt hat und ob bei dieser Verwendung erhebliche
Verletzungen entstehen würden.  
Entsprechend sind Waffen nur solche im sog. technischen Sinn, d. h. Werkzeuge, die nach Art ihrer Anfertigung 
allgemein dazu bestimmt und geeignet sind, Menschen auf mechanischem oder chemischem Wege zu verletzen, 
mithin Schusswaffen, Hieb- und Stichwaffen, sowie Gaspistolen, nicht jedoch – mangels ihrer generellen
Bestimmung zur Verletzung von Menschen – Schreckschusspistolen. Auch hier gilt der gleiche Maßstab wie in § 224 
Absatz 1 Nummer 2 StGB und § 250 Absatz 2 Nummer 1 StGB. 
Im Vergleich zu § 54 Absatz 1 Nummer 1a AufenthG wurden in § 54 Absatz 1 Nummer 1d Buchstabe c nur
diejenigen Straftaten gegen die sexuelle Selbstbestimmung aufgeführt, bei denen eine Tatbegehung unter
Verwendung einer Waffe überhaupt denkbar ist. Straftaten gegen das Eigentum wurden nur im Fall eines Raubes und 
seiner Qualifikationstatbestände, eines räuberischen Diebstahls oder einer räuberischen Erpressung einbezogen, 
da nur hier die Verwendung einer Waffe oder eines anderen gefährlichen Werkzeugs bei der Tatbegehung in 
Betracht kommt. 
Zu Buchstabe b 
Mit der Einführung des neuen § 54 Absatz 2 Nummer 2b AufenthG wird ein neuer Ausweisungstatbestand für 
den Fall geschaffen, dass einer der aufgeführten Straftatbestände unter Verwendung einer Waffe oder eines
anderen gefährlichen Werkzeugs begangen worden ist.  
Dabei reicht wegen der konkreten Gefahr, dass die Verwendung einer Waffe oder eines anderen gefährlichen 
Werkzeugs zu einer erheblichen Verletzung führt, bereits eine Verurteilung zu einer Freiheitsstrafe zu drei
Monaten oder eine Verurteilung zu einer Jugendstrafe, deren Vollstreckung nicht zur Bewährung ausgesetzt worden 
ist, aus, um ein schwerwiegendes Ausweisungsinteresse zu begründen.
Zu Nummer 5 
Es handelt sich um Folgeänderungen aufgrund der Neufassung des § 60 Absatz 8 AufenthG. 
Zu Nummer 6 
Nach Artikel 33 Absatz 2 des Abkommens über die Rechtsstellung der Flüchtlinge vom 28. Juli 1951 (Genfer 
Flüchtlingskonvention) gilt das Verbot der Zurückweisung nicht für einen Flüchtling, der eine Gefahr für die 
Allgemeinheit dieses Staates bedeutet, weil er wegen eines Verbrechens oder eines besonders schweren
Vergehens rechtskräftig verurteilt wurde. 
Artikel 14 Absatz 4 Buchstabe b der Richtlinie 2011/95/EU des Europäischen Parlaments und des Rates vom 
13. Dezember 2011 über Normen für die Anerkennung von Drittstaatsangehörigen oder Staatenlosen als Personen 
mit Anspruch auf internationalen Schutz, für einen einheitlichen Status für Flüchtlinge oder für Personen mit 
Anrecht auf subsidiären Schutz und für den Inhalt des zu gewährenden Schutzes (Richtlinie 2011/95/EU) enthält 
eine entsprechende Regelung. Danach können die Mitgliedstaaten einem Flüchtling die ihm von einer
Regierungsoder Verwaltungsbehörde, einem Gericht oder einer gerichtsähnlichen Behörde zuerkannte Rechtsstellung
aberkennen, diese beenden oder ihre Verlängerung ablehnen, wenn er eine Gefahr für die Allgemeinheit dieses
Mitgliedstaats darstellt, weil er wegen einer besonders schweren Straftat rechtskräftig verurteilt wurde. In diesem Fall 
können die Mitgliedstaaten nach Artikel 14 Absatz 5 der Richtlinie 2011/95/EU ferner entscheiden, einem
Flüchtling eine Rechtsstellung nicht zuzuerkennen, solange noch keine Entscheidung darüber gefasst worden ist. Eine 
Mindeststrafe, die zum Ausschluss von der Flüchtlingsanerkennung führt, wird weder in der Genfer
Flüchtlingskonvention noch in der Richtlinie 2011/95/EU festgelegt. Bei der Beurteilung, wann eine besonders schwere 
Straftat vorliegt, ist dabei auf das Strafrechtssystem des einzelnen Mitgliedstaates abzustellen, da die Europäische 
Union im Bereich des Strafrechts nur eingeschränkte Regelungskompetenzen hat (Artikel 83 des Vertrages über 
die Arbeitsweise der Europäischen Union) und das Strafrecht nicht Gegenstand allgemeiner
Harmonisierungsmaßnahmen ist (EuGH, Urteil vom 6. Juli 2023, C-402/22, EU:C:2023:543, Rn. 38). Erforderlich ist jedoch stets 
die Feststellung, dass der Ausländer aufgrund seines persönlichen Verhaltens eine Gefahr für die Allgemeinheit 
darstellt, die bloße rechtskräftige Verurteilung wegen einer Straftat genügt hierfür nicht. Die Gefahr für die
Allgemeinheit muss im Einzelfall festgestellt werden. Dabei sind insbesondere Tatbegehungen zu berücksichtigen, 
die das Sicherheitsgefühl vieler Menschen beeinträchtigen. Dies ist etwa insbesondere bei Messerangriffen der 
Fall, da selbst kleine Messer schwere Verletzungen hervorrufen oder im schlimmsten Fall sogar tödlich sein
können. Gleiches gilt für Waffen nach dem Waffengesetz oder sonstige gefährliche Gegenstände, die nach ihrer
Beschaffenheit und der konkreten Art ihrer Verwendung geeignet sind, Verletzungsfolgen im Sinne von § 226 StGB 
oder den Tod herbeizuführen. In dem dadurch gezogenen Rahmen ist eine Änderung der Ausschlusstatbestände 
möglich. 
Zu Buchstabe a 
§ 60 Absatz 8 AufenthG-E ist eine redaktionelle Neufassung des § 60 Absatz 8 Satz 1 und 2 AufenthG. 
§ 60 Absatz 8 Nummer 1 und Nummer 2 AufenthG-E entspricht ohne inhaltliche Änderung § 60 Absatz 8 Satz 1 
erste Alternative und Satz 2 AufenthG. 
§ 60 Absatz 8 Nummer 3 AufenthG-E ergänzt den bisherigen § 60 Absatz 8 Satz 1 zweite Alternative AufenthG 
und bestimmt, dass auch Verurteilungen zu einer Jugendstrafe von mindestens drei Jahren wegen eines
Verbrechens oder besonders schweren Vergehens vom Ausschlusstatbestand erfasst sind. Bisher galt die Regelung nur 
für Freiheitsstrafen (siehe auch zur Vorgängerregelung des § 51 Absatz 3 Satz 1 des Ausländergesetzes, BVerwG, 
Urteil vom 16. November 2000 – 9 C 4/00, BVerwGE 112, 180). Dadurch bestand zum einen eine
Regelungslücke, da Jugendstrafen von mehr als drei Jahren, die nicht vom Anwendungsbereich des § 60 Absatz 8 Satz 3 
AufenthG erfasst wurden, nicht zu einem Schutzausschluss führen konnten. Zum anderen ist die Einbeziehung 
von Jugendstrafen von mehr als drei Jahren auch sachgerecht, da die Tatsache, dass es sich bei dem betroffenen 
Ausländer um einen Jugendlichen oder Heranwachsenden handelt, bereits bei der Strafzumessung, unter anderem 
durch einen abweichenden Strafrahmen nach § 18 JGG, Berücksichtigung findet. 
Zu Buchstabe b 
In § 60 Absatz 8a und 8b AufenthG-E wird die bisherige Beschränkung auf Straftaten gegen das Leben, die
körperliche Unversehrtheit, die sexuelle Selbstbestimmung, das Eigentum oder wegen Widerstands gegen
Vollstreckungsbeamte gestrichen. Die besondere Schwere der Straftat richtet sich maßgeblich nach dem Strafrahmen
eines Straftatbestands. Durch diesen hat der Gesetzgeber den Rahmen vorgegeben, innerhalb dessen eine
schuldangemessene Strafe zu finden ist. Die bisherige Beschränkung auf bestimmte Rechtsgüter führte zu
Regelungslücken. So führten etwa antisemitische Volksverhetzungen nach § 130 StGB, die auch aufgrund der historischen 
Verantwortung Deutschlands im Einzelfall als besonders schwere Straftat und Gefahr für die Allgemeinheit zu 
qualifizieren sind, nicht zum Ausschluss vom Schutzstatus führen, wenn die Freiheitsstrafe unter drei Jahren blieb.  
Allein die Verurteilung zu einer Freiheitsstrafe von mehr als einem Jahr ist nicht ausreichend. Vielmehr muss es 
sich weiterhin um eine Straftat nach § 177 StGB handeln oder die Straftat muss mit Gewalt, unter Anwendung 
von Drohung mit Gefahr für Leib oder Leben oder mit List begangen worden sein.  
Ergänzt wird der § 60 Absatz 8a und 8b AufenthG-E um die Einschleusungstatbestände der §§ 96 und 97
AufenthG. Die Schleusungskriminalität hat sich zum profitablen Geschäftszweig der Organisierten Kriminalität
entwickelt. Die Schleuser agieren dabei zunehmend rücksichtsloser und brutaler gegenüber den geschleusten
Personen und den kontrollierenden Polizeibeamtinnen und Polizeibeamten. Die Anzahl an lebensgefährlichen
Behältnisschleusungen, einhergehend mit einem extrem rücksichtslosen Verhalten der Schleuser steigt stark an. Die 
Schleuser brechen mit ihren Transportfahrzeugen in sehr vielen Fällen in Kontrollstellen oder während des
Anhaltevorganges durch und gefährden dabei die eingesetzten Polizeibeamtinnen und Polizeibeamten häufig in einer 
zum Teil lebensgefährlichen Art und Weise. Sehr oft werden hierbei neben den geschleusten Personen
unbeteiligte Verkehrsteilnehmerinnen und Verkehrsteilnehmer gefährdet und in teilweise schwere Unfälle verwickelt. 
Mit dem Gesetz zur Verbesserung der Rückführung (Rückführungsverbesserungsgesetz), BGBl. 2024 I Nr. 54 
vom 26.02.2024, wurde die Strafandrohungen der §§ 96 und 97 des Aufenthaltsgesetzes angepasst, um die
Sozialschädlichkeit des konkreten Schleusungsverhaltens widerspiegeln zu können und die
Strafzumessungsentscheidung des Gerichts sachgerecht anzuleiten. Zur Bekämpfung der Schleuserkriminalität müssen allerdings weitere 
Anstrengungen unternommen werden, um diese besonders sozialschädliche Form kriminellen Verhaltens mit
allen verfügbaren Mitteln zurückzudrängen. Durch die Aufnahme der §§ 96 und 97 AufenthG wird daher
klargestellt, dass die Verwirklichung dieser sozialschädlichen Tatbestände ebenfalls zur Entziehung eines Schutzstatus 
führen kann.  
Zusätzlich werden zukünftig auch Straftaten erfasst, bei denen im Rahmen des Urteils ein antisemitischer,
rassistischer, fremdenfeindlicher, geschlechtsspezifischer, gegen die sexuelle Orientierung gerichteter oder sonstiger 
menschenverachtender Beweggrund im Sinne von § 46 Absatz 2 Satz 2 StGB ausdrücklich festgestellt wurde. 
Dies ist erforderlich, um Formen der Hass- und Vorurteilskriminalität zu erfassen, die eine besondere Gefahr für 
den gesellschaftlichen Frieden und die Allgemeinheit darstellen. 
§ 60 Absatz 8a und 8b AufenthG-E unterscheiden sich im Hinblick auf das Ermessen. Während § 60 Absatz 8b 
AufenthG-E entsprechend der bisherigen Regelung des § 60 Absatz 8 Satz 3 AufenthG bei einer Freiheits- oder 
Jugendstrafe von mehr als einem Jahr ein Ermessen einräumt („kann“), ist dieses Ermessen bei einer
Freiheitsoder Jugendstrafe von mehr als zwei Jahren gebunden („soll“). Das gebundene Ermessen ergibt sich aus der
Wertung des Gesetzgebers, dass bei einer Freiheits- und Jugendstrafe von mehr als zwei Jahren die Aussetzung der 
Strafe zur Bewährung ausgeschlossen ist (§ 56 Absatz 2 Satz 1 erster Halbsatz StGB und § 21 Absatz 2 JGG). 
Zu Nummer 7 
Es handelt sich um eine Folgeänderung der Neufassung des § 60 Absatz 8 AufenthG. Darüber hinaus werden auch 
Daten zu Versagungsgründen nach § 60 Absatz 8a und 8b AufenthG-E aufgenommen. Ziel des
Asylkonsultationsverfahren nach § 73 Absatz 1a und 3a AufenthG ist es, den Datenaustausch zwischen den Sicherheitsbehörden 
und den für das Asylverfahren sowie für aufenthaltsrechtliche Entscheidungen zuständigen Behörden im Hinblick 
auf mögliche Versagungsgründe zu gewährleisten. Nach der bisherigen Regelung waren Daten zum
Versagungsgrund des § 60 Absatz 8 Satz 3 AufenthG nicht erfasst. Diese Regelungslücke wird durch die Aufnahme des § 60 
Absatz 8a und 8b AufenthG-E geschlossen. 
Zu Nummer 8 
Entsprechend der in § 47b AufenthG geschaffenen Anzeigepflicht sind zukünftige Verstöße ordnungsrechtlich zu 
belangen und mit einer entsprechenden Geldbuße zu versehen.
Zu Artikel 4 (Änderung des Asylbewerberleistungsgesetzes) 
Zu Nummer 1 
Neu aufgenommen in den Geltungsbereich des § 1 Absatz 4 des Asylbewerberleistungsgesetzes (AsylbLG)
werden Leistungsberechtigte nach § 1 Absatz 1 Nummer 5 AsylbLG, deren Asylantrag durch eine Entscheidung des 
Bundesamtes für Migration und Flüchtlinge nach § 29 Absatz 1 Nummer 1 in Verbindung mit § 31 Absatz 6 
AsylG als unzulässig abgelehnt wurde und für die eine Abschiebung nach § 34a Absatz 1 Satz 1 zweite
Alternative AsylG angeordnet wurde, auch wenn die Entscheidung noch nicht unanfechtbar ist. Eine Entscheidung als 
unzulässig ergeht, wenn ein anderer Staat nach Maßgabe der Verordnung (EU) Nr. 604/2013 zuständig ist. Eine 
freiwillige Ausreise bzw. Überstellung erfolgt nur, nachdem der andere Staat der Übernahme ausdrücklich oder 
stillschweigend zugestimmt hat und dem Asylsuchenden in diesem Staat keine unmenschliche oder erniedrigende 
Behandlung droht. Dies ist etwa der Fall, wenn der Asylsuchende kein Recht auf Leistungen nach der Richtlinie 
2013/33/EU hat.  Zudem muss die Ausreise tatsächlich möglich sein. Fehlt es an diesen Voraussetzungen, erfolgt 
keine Überstellung und die Ausreisepflicht ist ausgesetzt. Damit erfolgt kein Leistungsausschluss.  
Anstelle von eingeschränkten Leistungen nach § 1a Absatz 7 in Verbindung mit § 1a Ab-satz 1 AsylbLG erhalten 
die betroffenen Personen zukünftig nach der Neuregelung ausdrücklich keine Leistungen nach dem
Asylbewerberleistungsgesetz. Sie erhalten grundsätzlich nur Überbrückungsleistungen für einen Zeitraum von zwei Wochen 
einmalig innerhalb von zwei Jahren. Bei dem betroffenen Personenkreis handelt es sich um Ausländer, die 
Deutschland kurzfristig verlassen müssen, weil ihr Asylantrag nach § 29 Absatz 1 Nummer 1a AsylG als
unzulässig abgelehnt und die Abschiebung nach § 34a Absatz 1 Satz 1 zweite Alternative AsylG angeordnet wurde. 
Dabei handelt es sich grundsätzlich um Ausländer, bei denen typisierend davon auszugehen ist, dass sie erst vor 
sehr kurzer Zeit nach Deutschland eingereist sind. Daher ist die Annahme gerechtfertigt, dass es für sie im
Regelfall mit keinem unverhältnismäßigen Aufwand verbunden ist, Deutschland kurzfristig wieder zu verlassen und in 
das Land zurückzukehren, das entsprechend der Verordnung (EU) Nr. 604/2013 des Europäischen Parlaments 
und des Rates vom 26. Juni 2013 zur Festlegung der Kriterien und Verfahren zur Bestimmung des Mitgliedstaats, 
der für die Prüfung eines von einem Drittstaatsangehörigen oder Staatenlosen in einem Mitgliedstaat gestellten 
Antrags auf internationalen Schutz zuständig ist (ABl. L 180 vom 29.6.2013, S. 31) für die Durchführung ihres 
Asylverfahrens zuständig ist. Härtefällen wird durch die Regelungen in den Sätzen 5 bis 8 Rechnung getragen. 
Der Umfang der Härtefallleistungen wird auf denjenigen der Härtefälle bei Anspruchseinschränkungen nach § 1a 
Absatz 1 AsylbLG abgesenkt, da von § 1 Absatz 4 Nummer 1 AsylbLG erfasste Ausländer keine höheren Bedarfe 
gegenüber den von § 1a Absatz 1 AsylbLG erfassten Ausländern haben. Um dem Ziel des Leistungsausschlusses 
zu entsprechen, wird die Gewährung von Geldleistungen ausgeschlossen; neben der Erbringung in Form der
Sachleistung verbleiben insbesondere die Bezahlkarte und Wertgutscheine. Ebenso werden die Voraussetzungen zum 
Bezug von Härtefallleistungen sowie die Informationspflichten hierüber angepasst, und in Hinblick auf eine
amtsärztlich festgestellte Reiseunfähigkeit konkretisiert. Leistungen zur Deckung der besonderen Bedürfnisse von 
Kindern werden gewährt. 
Der bloße Verbleib des Ausreisepflichtigen im Bundesgebiet oder die Aussicht auf geringere Leistungen im 
schutzgewährenden oder zuständigen Mitgliedstaat begründen dabei keine außergewöhnliche Härte. 
Zu Nummer 2 
Es handelt sich um eine Folgeänderung aufgrund der Neufassung des § 1 Absatz 4 Satz 1 AsylbLG-E. Im Übrigen 
kann die Regelung des § 1a Absatz 7 AsylbLG für Leistungsberechtigte nach § 1 Absatz 1 Nummer 1 AsylbLG 
entfallen, da es für sie keinen Anwendungsfall gibt. 
Zu Artikel 5 (Änderung des Waffengesetzes) 
Zu Nummer 1 
Zu Buchstabe a 
Es handelt sich um eine redaktionelle Anpassung der Inhaltsübersicht aufgrund der Einführung der neuen §§ 6a 
und 6b. 
Zu Buchstabe b 
Es handelt sich um eine redaktionelle Anpassung aufgrund der Ergänzung des § 42.
Zu Buchstabe c 
Es handelt sich um eine redaktionelle Anpassung der Inhaltsübersicht aufgrund der Einführung der neuen §§ 42a 
und 42b. 
Zu Buchstabe d 
Es handelt sich um eine redaktionelle Anpassung auf Grund der Ergänzung des § 45. 
Zu Nummer 2 (§ 4) 
Zu Buchstabe a (§ 4 Absatz 5) 
Die klarstellende Regelung schafft Rechtssicherheit für die zuständige Behörde und verbessert den Vollzug. Der 
neue Satz 2 konkretisiert, wann ein begründeter Einzelfall für die Anordnung des persönlichen Erscheinens
vorliegt. Der neue Satz 3 stellt klar, dass sich Anhaltspunkte, die Zweifel an der Zuverlässigkeit oder persönlichen 
Eignung begründen, beispielsweise aus dem Schriftverkehr oder Telefonaten der betroffenen Person mit der
zuständigen Behörde oder aus öffentlich zugänglichen Quellen ergeben können. Durch diese Regelung wird die 
Verwaltungspraxis für die Waffenbehörden erleichtert und diese so ermutigt, das persönliche Erscheinen öfters 
anzuordnen. 
Zu Buchstabe b (§ 4 Absatz 6) 
Der neue Absatz 6 stellt klar, dass die Waffenbehörden zur Erkenntnisgewinnung auch in öffentlich zugänglichen 
Quellen, insbesondere dem Internet, aber auch Printveröffentlichungen, recherchieren und die gewonnenen
Erkenntnisse im weiteren Verfahren nutzen dürfen. 
Zu Nummer 3 (§ 5) 
Zu Buchstabe a (§ 5 Absatz 1) 
Nach derzeitiger Rechtslage legt § 5 Absatz 1 Nummer 1 WaffG absolut, also unwiderleglich fest, dass eine
Person dann die für die waffenrechtliche Erlaubnis erforderliche Zuverlässigkeit nicht besitzt, wenn diese Person 
wegen eines Verbrechens oder einer sonstigen vorsätzlichen Straftat im Einzelfall zu einer Freiheitsstrafe von 
mindestens einem Jahr rechtskräftig verurteilt worden ist und seit dem Eintritt der Rechtskraft der letzten
Verurteilung zehn Jahre noch nicht verstrichen sind.  
Für sonstige vorsätzliche Straftaten gilt, unter den Voraussetzungen nach § 5 Absatz 2 Nummer 1a WaffG nach 
bisherigen Rechtlage bei einer rechtskräftigen Verurteilung zu einer Freiheitsstrafe von weniger als einem Jahr, 
bislang lediglich die widerlegbare Regelvermutung der Unzuverlässigkeit. Damit besteht nach derzeitiger
Rechtslage für Personen, die wegen einer staatsgefährdenden oder extremistischen Straftat, wie etwa der Unterstützung 
einer terroristischen Vereinigung nach § 129b Absatz 3 StGB zu einer Freiheitsstrafe von weniger als einem Jahr 
verurteilt worden sind, im Einzelfall die Möglichkeit, die Regelvermutung der Unzuverlässigkeit zu widerlegen, 
obwohl sie durch ihr gerichtlich festgestelltes strafbares Verhalten hinreichend zum Ausdruck gebracht haben, 
dass sie verfassungsfeindliche Bestrebungen verfolgen.  
Um einen rechtmäßigen Zugang von Personen, die sich in der Vergangenheit extremistisch oder staatsgefährdend 
betätigt haben und wegen einer entsprechenden Straftat rechtskräftig verurteilt worden sind, zu
erlaubnispflichtigen Waffen zu unterbinden, soll der Straftatenkatalog für die absolute Unzuverlässigkeit schutzgutbezogen auf 
bestimmte staatsgefährdende und extremistische Straftaten ausgeweitet werden. Damit greift bei rechtskräftigen 
Verurteilungen wegen einer Straftat nach § 83 Absatz 2, nach den §§ 84, 85, 87, 88, 89, 89a, 89b, 89c, 91, 95 
Absatz 1, nach § 96 Absatz 2, nach den §§ 97b,  98 soweit nicht ein Fall des § 98 Absatz 2 StGB vorliegt, nach 
§ 99 Absatz 2 StGB soweit nicht ein Fall des § 99 Absatz 3 StGB vorliegt, nach § 100 Absatz 1 in Verbindung 
mit Absatz 4 StGB, nach den §§ 129, 129a Absatz 3 und 5 StGB, auch in Verbindung mit § 129b Absatz 1 StGB 
die Annahme der absoluten Unzuverlässigkeit, wenn seit Eintritt der Rechtskraft der letzten Verurteilung zehn 
Jahre noch nicht verstrichen sind. Damit entfallen für die Behörden in diesen Fällen komplexe und ggfs.
gerichtlich angreifbare Einzelfallabwägungen. 
Denn Zweck des Waffengesetzes ist es, die Risiken, die mit jedem Waffenbesitz ohnehin verbunden sind, auf ein 
Mindestmaß zu beschränken und nur bei solchen Personen hinzunehmen, die nach ihrem Verhalten Vertrauen 
darin verdienen, dass sie mit Waffen und Munition jederzeit und in jeder Hinsicht ordnungsgemäß umgehen
(BVerwG, stRspr, vgl. etwa Urteile vom 30. September 2009 – 6 C 29.08 – Buchholz 402.5 WaffG Nr. 100 Rn. 
17 m. w. N., vom 22. Oktober 2014 – 6 C 30.13 – Buchholz 402.5 WaffG Nr. 104 Rn. 19 und vom 28. Januar 
2015 – 6 C 1.14 – Buchholz 402.5 WaffG Nr. 105 Rn. 8, 17). Der Staat soll nicht das Risiko tragen, weitere 
extremistische oder staatsgefährdende Bestrebungen durch die Erteilung waffenrechtlicher Erlaubnisse zu
fördern. 
Die mit der Neuregelung in § 5 Absatz 1 Nummer 1 Buchstabe c WaffG aufgenommenen Straftatbestände tragen 
