referenznummer,docNr,docTyp,docText
2. das individuelle Verhalten einer Person die konkrete Wahrscheinlichkeit begründet, dass sie innerhalb 
eines übersehbaren Zeitraums eine Straftat nach § 5 Absatz 1 Satz 2 begehen wird, 
und die Verhütung der Straftat auf andere Weise aussichtslos ist oder wesentlich erschwert wäre. Ein
Abgleich mit Daten nach Satz 1 aus im Internet öffentlich zugänglichen Echtzeit-Lichtbild- und Echtzeit-
Videodateien ist ausgeschlossen. 
(2) Die Maßnahme nach Absatz 1 Satz 1 darf gegen die entsprechend § 17 oder § 18 des
Bundespolizeigesetzes Verantwortlichen, die in § 20 Absatz 1 des Bundespolizeigesetzes bezeichnete Person sowie
Personen im Sinne von Absatz 1 Satz 2 Nummer 1 oder 2 durchgeführt werden. 
(3) Maßnahmen nach Absatz 1 Satz 1 dürfen nur auf Antrag der zuständigen Abteilungsleitung durch 
das Gericht angeordnet werden. Bei Gefahr im Verzug kann die Anordnung auch durch die zuständige
Abteilungsleitung getroffen werden. Soweit die Anordnung der Abteilungsleitung nicht binnen drei Tagen von 
dem Gericht bestätigt wird, tritt sie außer Kraft. Die Anordnung ergeht schriftlich. In ihrer
Entscheidungsformel sind anzugeben: 
1. soweit möglich, die Person, zu deren Identifizierung oder Aufenthaltsermittlung die Maßnahme
angeordnet wird, 
2. die biometrischen Daten, die dieser Person zuzuordnen sind und die zum Abgleich herangezogen
werden sollen, und 
3. der Grund der Maßnahme.  
(4) In der Begründung der Anordnung sind die Voraussetzungen für die Maßnahme nach Absatz 1 
Satz 1 und die wesentlichen Abwägungsgesichtspunkte darzulegen. Insbesondere sind einzelfallbezogen die 
bestimmten Tatsachen, die den Verdacht begründen, und die wesentlichen Erwägungen zur Erforderlichkeit 
und Verhältnismäßigkeit der Maßnahme anzugeben. 
(5) Liegen tatsächliche Anhaltspunkte für die Annahme vor, dass durch eine Maßnahme nach Absatz 1 
Satz 1 allein Erkenntnisse aus dem Kernbereich privater Lebensgestaltung erlangt werden, ist die Maßnahme 
unzulässig. Erkenntnisse aus dem Kernbereich privater Lebensgestaltung, die durch eine Maßnahme nach 
Absatz 1 Satz 1 erlangt wurden, dürfen nicht verwertet werden. Aufzeichnungen über solche Erkenntnisse 
sind unverzüglich zu löschen. Die Tatsache ihrer Erlangung und Löschung ist zu dokumentieren. Bei
Maßnahmen nach Absatz 1 Satz 1 ist, soweit möglich, technisch sicherzustellen, dass Daten, die den Kernbereich 
privater Lebensgestaltung betreffen, nicht erhoben werden. Erkenntnisse, die durch Maßnahmen nach
Absatz 1 Satz 1 erlangt wurden und den Kernbereich privater Lebensgestaltung betreffen, sind unverzüglich zu 
löschen oder von der Abteilungsleitung dem anordnenden Gericht zur Entscheidung über die Verwertbarkeit 
und Löschung der Daten vorzulegen. Die Entscheidung des Gerichts über die Verwertbarkeit ist für das 
weitere Verfahren bindend. 
(6) Für die nach Absatz 1 Satz 1 abzugleichenden Daten gilt § 12 Absatz 2 entsprechend. Der
Abgleich mit Daten, die durch die in § 12 Absatz 3 genannten Maßnahmen erlangt wurden, ist ausgeschlossen. 
(7) Die im Rahmen des Abgleichs nach Absatz 1 Satz 1 erhobenen Daten sind nach Durchführung des 
Abgleichs unverzüglich zu löschen, soweit sie keinen konkreten Ermittlungsansatz für den
Ausgangssachverhalt aufweisen. 
(8) Bei jeder Maßnahme nach Absatz 1 Satz 1 ist die Bezeichnung der eingesetzten automatisierten 
Anwendung zur Datenverarbeitung, der Zeitpunkt ihres Einsatzes und die Organisationseinheit, die die
Maßnahme durchführt, zu protokollieren.“ 
9. Nach § 63a wird folgender § 63b eingefügt: 
„§ 63b 
Nachträglicher biometrischer Abgleich mit öffentlich zugänglichen Daten aus dem Internet 
(1) Das Bundeskriminalamt kann biometrische Daten zu Gesichtern und Stimmen, auf die es zur
Erfüllung seiner Aufgaben zugreifen darf, mit öffentlich zugänglichen personenbezogenen Daten aus dem
Internet mittels einer automatisierten Anwendung zur Datenverarbeitung biometrisch abgleichen, sofern dies 
im Einzelfall erforderlich ist zur Identifizierung oder Ermittlung des Aufenthaltsorts der Zielperson 
1. zur Abwehr einer Gefahr für eine zu schützende Person oder für eine zu schützende Räumlichkeit nach 
§ 6 oder 
2. zum Schutz von Leib, Leben, Freiheit, sexueller Selbstbestimmung oder bedeutenden Sachwerten einer 
zu schützenden Person oder zum Schutz einer zu schützenden Räumlichkeit nach § 6, wenn Tatsachen 
den Schluss auf ein wenigstens seiner Art nach konkretisiertes und zeitlich absehbares Geschehen
zulassen, an dem bestimmte Personen beteiligt sein werden, oder 
3. zum Schutz von Leib, Leben, Freiheit oder sexueller Selbstbestimmung einer zu schützenden Person 
oder zum Schutz einer zu schützenden Räumlichkeit nach § 6, wenn das individuelle Verhalten einer 
Person die konkrete Wahrscheinlichkeit begründet, dass sie in einem übersehbaren Zeitraum eine
Straftat gegen eines dieser Rechtsgüter der zu schützenden Person oder gegen eine zu schützende
Räumlichkeit begehen wird, 
und die Abwehr der Gefahr auf andere Weise aussichtlos oder wesentlich erschwert wäre. Ein Abgleich mit 
Daten nach Satz 1 aus im Internet öffentlich zugänglichen Echtzeit-Lichtbild- und Echtzeit-Videodateien ist 
ausgeschlossen. 
(2) Die Maßnahme nach Absatz 1 Satz 1 darf nur gegen die entsprechend § 17 oder § 18 des
Bundespolizeigesetzes Verantwortlichen, die in § 20 Absatz 1 des Bundespolizeigesetzes bezeichnete Person sowie 
Personen im Sinne von Absatz 1 Satz 1 Nummer 2 oder 3 durchgeführt werden. 
(3) Maßnahmen nach Absatz 1 Satz 1 dürfen nur auf Antrag der zuständigen Abteilungsleitung durch 
das Gericht angeordnet werden. Bei Gefahr im Verzug kann die Anordnung auch durch die zuständige
Abteilungsleitung getroffen werden. Soweit die Anordnung der Abteilungsleitung nicht binnen drei Tagen von 
dem Gericht bestätigt wird, tritt sie außer Kraft. Die Anordnung ergeht schriftlich. In ihrer
Entscheidungsformel sind anzugeben: 
1. soweit möglich, die Person, zu deren Identifizierung oder Aufenthaltsermittlung die Maßnahme
angeordnet wird,  
2. die biometrischen Daten, die dieser Person zuzuordnen sind und die zum Abgleich herangezogen
werden sollen, und
3. der Grund der Maßnahme.  
(4) In der Begründung der Anordnung sind die Voraussetzungen für die Maßnahme nach Absatz 1 
Satz 1 und die wesentlichen Abwägungsgesichtspunkte darzulegen. Insbesondere sind einzelfallbezogen die 
bestimmten Tatsachen, die den Verdacht begründen, und die wesentlichen Erwägungen zur Erforderlichkeit 
und Verhältnismäßigkeit der Maßnahme anzugeben. 
(5) Liegen tatsächliche Anhaltspunkte für die Annahme vor, dass durch eine Maßnahme nach Absatz 1 
Satz 1 allein Erkenntnisse aus dem Kernbereich privater Lebensgestaltung erlangt werden, ist die Maßnahme 
unzulässig. Erkenntnisse aus dem Kernbereich privater Lebensgestaltung, die durch eine Maßnahme nach 
Absatz 1 Satz 1 erlangt wurden, dürfen nicht verwertet werden. Aufzeichnungen über solche Erkenntnisse 
sind unverzüglich zu löschen. Die Tatsache ihrer Erlangung und Löschung ist zu dokumentieren. Bei
Maßnahmen nach Absatz 1 Satz 1 ist, soweit möglich, technisch sicherzustellen, dass Daten, die den Kernbereich 
privater Lebensgestaltung betreffen, nicht erhoben werden. Erkenntnisse, die durch Maßnahmen nach
Absatz 1 Satz 1 erlangt wurden und den Kernbereich privater Lebensgestaltung betreffen, sind unverzüglich zu 
löschen oder von der Abteilungsleitung dem anordnenden Gericht zur Entscheidung über die Verwertbarkeit 
und Löschung der Daten vorzulegen. Die Entscheidung des Gerichts über die Verwertbarkeit ist für das 
weitere Verfahren bindend. 
(6) Für die nach Absatz 1 Satz 1 abzugleichenden Daten gilt § 12 Absatz 2 entsprechend. Der
Abgleich mit Daten, die durch die in § 12 Absatz 3 genannten Maßnahmen erlangt wurden, ist ausgeschlossen. 
(7) Die im Rahmen der Maßnahme nach Absatz 1 Satz 1 erhobenen Daten sind nach Durchführung 
des Abgleichs unverzüglich zu löschen, soweit sie keinen konkreten Ermittlungsansatz für den
Ausgangssachverhalt aufweisen. 
(8) Bei jeder Maßnahme nach Absatz 1 Satz 1 ist die Bezeichnung der eingesetzten automatisierten 
Anwendung zur Datenverarbeitung, der Zeitpunkt ihres Einsatzes und die Organisationseinheit, die die
Maßnahme durchführt, zu protokollieren.“ 
Artikel 2 
Änderung des Bundespolizeigesetzes 
Das Bundespolizeigesetz vom 19. Oktober 1994 (BGBl. I S. 2978, 2979), das zuletzt durch Artikel 5 des 
Gesetzes vom 6. Mai 2024 (BGBl. 2024 I Nr. 149) geändert worden ist, wird wie folgt geändert: 
1. In der Inhaltsübersicht werden nach der Angabe zu § 34 die folgenden Angaben eingefügt: 
„§ 34a Automatisierte Datenanalyse 
§ 34b Nachträglicher biometrischer Abgleich mit öffentlich zugänglichen Daten aus dem Internet“. 
2. Nach § 22 Absatz 1a wird folgender Absatz 1b eingefügt: 
„(1b) Die Bundespolizei kann zur Durchsetzung von Waffenverbotszonen nach § 42 Absatz 7 des
Waffengesetzes sowie zur Durchsetzung von Allgemeinverfügungen der Bundespolizei auf dem Gebiet der
Eisenbahnen des Bundes, welche das Mitführen von konkret bezeichneten gefährlichen Gegenständen und 
Waffen untersagt, Personen kurzzeitig anhalten, befragen und verlangen, dass mitgeführte Ausweispapiere 
zur Prüfung ausgehändigt werden, sowie mitgeführte Sachen in Augenschein nehmen und durchsuchen. Die 
Auswahl der nach Satz 1 durch die Bundespolizei kontrollierten Person anhand eines Merkmals im Sinne 
des Artikels 3 Absatz 3 des Grundgesetzes ohne sachlichen, durch den Zweck der Maßnahme
gerechtfertigten Grund ist unzulässig.“
3. Nach § 34 werden die folgenden §§ 34a und 34b eingefügt: 
„§ 34a 
Automatisierte Datenanalyse 
(1) Die Bundespolizei kann zur Erfüllung ihrer Aufgaben nach den §§ 1 bis 8 personenbezogene
Daten, die sie zur Erfüllung der ihr obliegenden Aufgaben weiterverarbeitet oder für die sie eine Berechtigung 
zum Abruf hat, mittels einer automatisierten Anwendung zur Datenverarbeitung zusammenführen und
darüber hinaus zum Zwecke der Analyse weiterverarbeiten, sofern 
1. dies zur Abwehr einer im Einzelfall bestehenden Gefahr für den Bestand oder die Sicherheit des Bundes 
oder eines Landes oder für Leib, Leben oder Freiheit einer Person oder Sachen von bedeutendem Wert, 
deren Erhaltung im öffentlichen Interesse geboten ist, erforderlich ist, 
2. bestimmte Tatsachen die Annahme rechtfertigen, dass eine Person innerhalb eines übersehbaren
Zeitraums auf eine zumindest ihrer Art nach konkretisierte Weise eine Straftat im Zusammenhang mit
lebensgefährdenden Schleusungen oder eine Straftat, die gegen die Sicherheit der Anlagen oder des
Betriebes des Luft-, See- oder Bahnverkehrs, insbesondere Straftaten nach den §§ 315, 315b, 316b und 
316c des Strafgesetzbuches, gerichtet ist und eine nicht unerhebliche Gefährdung eines der in
Nummer 1 genannten Rechtsgüter erwarten lässt, begehen wird, und dies zur Verhütung der Straftat
erforderlich ist oder  
3. das individuelle Verhalten einer Person die konkrete Wahrscheinlichkeit begründet, dass sie innerhalb 
eines übersehbaren Zeitraums eine Straftat im Zusammenhang mit lebensgefährdenden Schleusungen 
oder eine Straftat, die gegen die Sicherheit der Anlagen oder des Betriebes des Luft-, See- oder
Bahnverkehrs gerichtet ist, insbesondere Straftaten nach den §§ 315, 315b, 316b und 316c des
Strafgesetzbuches, und eine nicht unerhebliche Gefährdung eines der in Nummer 1 genannten Rechtsgüter
erwarten lässt, begehen wird, und dies zur Verhütung der Straftat erforderlich ist. 
(2) Im Rahmen der Weiterverarbeitung nach Absatz 1 können insbesondere datei- und
informationssystemübergreifend Beziehungen oder Zusammenhänge zwischen Personen, Personengruppierungen,
Institutionen, Organisationen, Objekten und Sachen hergestellt, unbedeutende Informationen und Erkenntnisse 
ausgeschlossen, Suchkriterien gewichtet, die eingehenden Erkenntnisse zu bekannten Sachverhalten
zugeordnet sowie gespeicherte Daten statistisch ausgewertet werden. 
(3) Beim Einsatz selbstlernender Systeme gilt § 22 Absatz 3 Satz 2 und 3 des
Bundeskriminalamtgesetzes entsprechend. 
§ 34b  
Nachträglicher biometrischer Abgleich mit öffentlich zugänglichen Daten aus dem Internet 
(1) Die Bundespolizei kann biometrische Daten zu Gesichtern und Stimmen, die sie zur Erfüllung 
ihrer Aufgaben nach den §§ 1 bis 8 weiterverarbeitet oder für die sie eine Berechtigung zum Abruf hat, mit 
öffentlich zugänglichen personenbezogenen Daten aus dem Internet mittels einer automatisierten
Anwendung zur Datenverarbeitung biometrisch abgleichen, sofern 
1. dies im Rahmen der Abwehr einer im Einzelfall bestehenden Gefahr für den Bestand oder die Sicherheit 
des Bundes oder eines Landes oder für Leib, Leben oder Freiheit einer Person oder Sachen von
bedeutendem Wert, deren Erhaltung im öffentlichen Interesse geboten ist, zur Identifizierung oder Ermittlung 
des Aufenthaltsorts der Zielperson erforderlich ist und 
2. die Abwehr der Gefahr auf andere Weise aussichtslos ist oder wesentlich erschwert wäre.
Die Maßnahme nach Satz 1 ist auch zulässig, sofern im Rahmen der Aufgaben nach den §§ 1 bis 8 
1. bestimmte Tatsachen die Annahme rechtfertigen, dass eine Person innerhalb eines übersehbaren
Zeitraums auf eine zumindest ihrer Art nach konkretisierte Weise eine Straftat im Zusammenhang mit
lebensgefährdenden Schleusungen oder eine Straftat, die gegen die Sicherheit der Anlagen oder des
Betriebes des Luft-, See- oder Bahnverkehrs, insbesondere Straftaten nach den §§ 315, 315b, 316b und 
316c des Strafgesetzbuches, gerichtet ist und eine nicht unerhebliche Gefährdung eines der in Satz 1 
Nummer 1 genannten Rechtsgüter erwarten lässt, begehen wird, oder 
2. das individuelle Verhalten einer Person die konkrete Wahrscheinlichkeit begründet, dass sie innerhalb 
eines übersehbaren Zeitraums eine Straftat im Zusammenhang mit lebensgefährdenden Schleusungen 
oder eine Straftat, die gegen die Sicherheit der Anlagen oder des Betriebes des Luft-, See- oder
Bahnverkehrs gerichtet ist, insbesondere Straftaten nach den §§ 315, 315b, 316b und 316c des
Strafgesetzbuches, und eine nicht unerhebliche Gefährdung eines der in Satz 1 Nummer 1 genannten Rechtsgüter 
erwarten lässt, begehen wird, 
und die Verhütung der Straftat auf andere Weise aussichtslos oder wesentlich erschwert wäre. Ein Abgleich 
mit Daten nach Satz 1 aus im Internet öffentlich zugänglichen Echtzeit-Lichtbild- und Echtzeit-Videodateien 
ist ausgeschlossen 
(2) Die Maßnahme nach Absatz 1 Satz 1 darf nur gegen die gemäß § 17 oder § 18 Verantwortlichen, 
die in § 20 Absatz 1 bezeichnete Person sowie Personen im Sinne von Absatz 1 Satz 2 Nummer 1 oder 2 
durchgeführt werden. 
(3) Maßnahmen nach Absatz 1 Satz 1 dürfen nur auf Antrag der zuständigen Abteilungsleitung des 
Bundespolizeipräsidiums oder dem Präsidenten einer Bundespolizeidirektion durch das Gericht angeordnet 
werden. Für das Verfahren gelten die Vorschriften des Gesetzes über das Verfahren in Familiensachen und 
in den Angelegenheiten der freiwilligen Gerichtsbarkeit mit Ausnahme des § 23 Absatz 2 und des § 37
Absatz 2 entsprechend. Die Anordnung wird mit Erlass wirksam. Bei Gefahr im Verzug kann die Anordnung 
auch durch die zuständige Abteilungsleitung des Bundespolizeipräsidiums oder den Präsidenten einer
Bundespolizeidirektion getroffen werden. Soweit die Anordnung der Abteilungsleitung nicht binnen drei Tagen 
von dem Gericht bestätigt wird, tritt sie außer Kraft. Die Anordnung ergeht schriftlich. In ihrer
Entscheidungsformel sind anzugeben: 
1. soweit möglich, die Person, zu deren Identifizierung oder Aufenthaltsermittlung die Maßnahme
angeordnet wird,  
2. die biometrischen Daten, die dieser Person zuzuordnen sind, und die zum Abgleich herangezogen
werden sollen, und  
3. der Grund der Maßnahme.  
(4) In der Begründung der Anordnung sind die Voraussetzungen für die Maßnahme nach Absatz 1 
Satz 1 und die wesentlichen Abwägungsgesichtspunkte darzulegen. Insbesondere sind einzelfallbezogen die 
bestimmten Tatsachen, die den Verdacht begründen, und die wesentlichen Erwägungen zur Erforderlichkeit 
und Verhältnismäßigkeit der Maßnahme anzugeben. 
(5) Liegen tatsächliche Anhaltspunkte für die Annahme vor, dass durch eine Maßnahme nach Absatz 1 
Satz 1 allein Erkenntnisse aus dem Kernbereich privater Lebensgestaltung erlangt werden, ist die Maßnahme 
unzulässig. Erkenntnisse aus dem Kernbereich privater Lebensgestaltung, die durch eine Maßnahme nach 
Absatz 1 Satz 1 erlangt wurden, dürfen nicht verwertet werden. Aufzeichnungen über solche Erkenntnisse 
sind unverzüglich zu löschen. Die Tatsache ihrer Erlangung und Löschung ist zu dokumentieren. Bei
Maßnahmen nach Absatz 1 Satz 1 ist, soweit möglich, technisch sicherzustellen, dass Daten, die den Kernbereich 
privater Lebensgestaltung betreffen, nicht erhoben werden. Erkenntnisse, die durch Maßnahmen nach
Absatz 1 Satz 1 erlangt wurden und den Kernbereich privater Lebensgestaltung betreffen, sind unverzüglich zu 
löschen oder von der Abteilungsleitung dem anordnenden Gericht zur Entscheidung über die Verwertbarkeit 
und Löschung der Daten vorzulegen. Die Entscheidung des Gerichts über die Verwertbarkeit ist für das 
weitere Verfahren bindend.
(6) Die im Rahmen des Abgleichs nach Absatz 1 Satz 1 erhobenen Daten sind nach Durchführung des 
Abgleichs unverzüglich zu löschen, soweit sie keinen konkreten Ermittlungsansatz für den
Ausgangssachverhalt aufweisen. 
(7) Bei jeder Maßnahme nach Absatz 1 Satz 1 ist die Bezeichnung der eingesetzten automatisierten 
Anwendung zur Datenverarbeitung, der Zeitpunkt ihres Einsatzes und die Organisationseinheit, die die
Maßnahme durchführt, zu protokollieren.“ 
4. § 43 Absatz 1 wird wie folgt geändert: 
a) In Nummer 3 wird das Wort „oder“ am Ende durch ein Komma ersetzt. 
b) In Nummer 4 wird der Punkt am Ende durch das Wort „oder“ ersetzt. 
c) Folgende Nummer 5 angefügt: 
5. „ in Fällen des § 22 Absatz 1b.“ 
Artikel 3 
Änderung der Strafprozessordnung 
Die Strafprozessordnung in der Fassung der Bekanntmachung vom 7. April 1987 (BGBl. I S. 1074, 1319), 
die zuletzt durch Artikel 3 des Gesetzes vom 30. Juli 2024 (BGBl. 2024 I Nr. 255) geändert worden ist, wird wie 
folgt geändert: 
1. In der Inhaltsübersicht wird nach der Angabe zu § 98c folgende Angabe eingefügt: 
„§ 98d Nachträglicher Abgleich biometrischer Daten mit im Internet öffentlich zugänglichen Daten mittels 
einer automatisierten Anwendung zur Datenverarbeitung“. 
2. Nach § 98c wird folgender § 98d eingefügt: 
„§ 98d 
Nachträglicher Abgleich biometrischer Daten mit im Internet öffentlich zugänglichen Daten mittels einer 
automatisierten Anwendung zur Datenverarbeitung 
(1) Zur Identitätsfeststellung oder Ermittlung des Aufenthaltsorts, eines Beschuldigten oder einer 
sonstigen Person, nach der für Zwecke eines Strafverfahrens gefahndet wird, durch Erkennung des Gesichts 
und der Stimme dürfen deren biometrische Daten aus einem Strafverfahren mit biometrischen Daten aus im 
Internet öffentlich zugänglichen Lichtbild- und Videodateien nachträglich mittels einer automatisierten
Anwendung zur Datenverarbeitung abgeglichen werden, wenn 
1. bestimmte Tatsachen den Verdacht begründen, dass jemand als Täter oder Teilnehmer eine in § 100a 
Absatz 2 bezeichnete schwere Straftat begangen, in Fällen, in denen der Versuch strafbar ist, zu begehen 
versucht oder durch eine Straftat vorbereitet hat,  
2. die Tat auch im Einzelfall schwer wiegt und  
3. die Identitätsfeststellung oder die Ermittlung des Aufenthaltsortes auf andere Weise wesentlich
erschwert oder aussichtslos wäre. 
Ein Abgleich mit Daten nach Satz 1 aus im Internet öffentlich zugänglichen Echtzeit-Lichtbild- und Echtzeit-
Videodateien ist ausgeschlossen. 
(2) Maßnahmen nach Absatz 1 dürfen nur auf Antrag der Staatsanwaltschaft durch das Gericht
angeordnet werden. Bei Gefahr im Verzug kann die Anordnung auch durch die Staatsanwaltschaft getroffen
werden. Soweit die Anordnung der Staatsanwaltschaft nicht binnen drei Tagen von dem Gericht bestätigt wird, 
tritt sie außer Kraft. Die Anordnung ergeht schriftlich. In ihrer Entscheidungsformel sind anzugeben: 
1. die Person, zu deren Identifizierung oder Aufenthaltsermittlung die Maßnahme angeordnet wird,  
2. die biometrischen Daten aus dem Strafverfahren, die dieser Person zuzuordnen sind und die zum
Abgleich herangezogen werden sollen, und  
3. der Tatvorwurf, auf Grund dessen die Maßnahme angeordnet wird. 
(3) In der Begründung der Anordnung sind die Voraussetzungen für die Maßnahme nach Absatz 1 
und die wesentlichen Abwägungsgesichtspunkte darzulegen. Insbesondere sind einzelfallbezogen die
bestimmten Tatsachen, die den Verdacht begründen, und die wesentlichen Erwägungen zur Erforderlichkeit 
und Verhältnismäßigkeit der Maßnahme anzugeben.  
(4) §100d Absatz 1 bis 3 gilt entsprechend. 
(5) Die im Rahmen des Abgleichs nach Absatz 1 erhobenen Daten sind nach Durchführung des
Abgleichs unverzüglich zu löschen, soweit sie keinen konkreten Ermittlungsansatz aufweisen. Dies gilt auch 
für sonstige erhobene Daten, soweit schutzwürdige Interessen des Betroffenen im Einzelfall gegenüber dem 
Strafverfolgungsinteresse überwiegen. Im Fall des Absatzes 2 Satz 3 sind alle bereits erhobenen Daten
unverzüglich zu löschen. Die Löschung ist aktenkundig zu machen.  
(6) Bei jeder Maßnahme ist die Bezeichnung der eingesetzten automatisierten Anwendung zur
Datenverarbeitung, der Zeitpunkt ihres Einsatzes und die Organisationseinheit, die die Maßnahme durchführt, zu 
protokollieren. Nach Beendigung einer Maßnahme nach Absatz 1 ist die Stelle zu unterrichten, die für die 
Kontrolle der Einhaltung der Vorschriften über den Datenschutz bei öffentlichen Stellen zuständig ist.“ 
3. § 101 wird wie folgt geändert: 
a) In Absatz 1 wird nach der Angabe „98a,“ die Angabe „98d,“ eingefügt. 
b) In Absatz 4 Satz 1 wird nach Nummer 1 folgende Nummer 1a eingefügt: 
„1a. des § 98d die Person, zu deren Identifizierung oder Aufenthaltsermittlung die Maßnahme
angeordnet wird,“. 
Artikel 4 
Inkrafttreten 
Dieses Gesetz tritt am Tag nach der Verkündung in Kraft. 
Berlin, den 9. September 2024 
Dr. Rolf Mützenich und Fraktion 
Katharina Dröge, Britta Haßelmann und Fraktion 
Christian Dürr und Fraktion
Begründung 
A. Allgemeiner Teil 
I. Zielsetzung und Notwendigkeit der Regelungen 
Waffenverbotszonen und Allgemeinverfügungen, die das Mitführen von Waffen und gefährlichen Gegenständen 
verbieten, können nur eine Wirkung entfalten, wenn sie effektiv durchgesetzt werden können. Hierzu bedarf es 
neuer Befugnisse für die Bundespolizei zur Kontrolle von Personen auf dem Gebiet der Eisenbahnen des Bundes, 
wenn dort das Mitführen von Waffen oder gefährlichen Gegenständen untersagt ist. 
Erfolgreiche Polizeiarbeit erfordert moderne und sachgerechte polizeiliche Befugnisse. Dies betrifft angesichts 
der aktuellen Herausforderungen – insbesondere bei der Terrorismusbekämpfung – zunehmend die digitale Welt. 
Bundeskriminalamt und Bundespolizei benötigen vor diesem Hintergrund Zugriff auf die erforderlichen Daten 
und müssen über die notwendigen Instrumente verfügen, Daten auszuwerten. Der Gesetzentwurf verfolgt das Ziel, 
das Bundeskriminalamt bei der Abwehr von Gefahren des internationalen Terrorismus, der Zentralstelle und beim 
Schutz von Verfassungsorganen sowie die Bundespolizei – insbesondere beim Grenzschutz – mit zeitgemäßen 
Befugnissen auszustatten. Zudem soll für alle Strafverfolgungsbehörden eine ausdrückliche
Ermächtigungsgrundlage geschaffen werden, die den Abgleich von öffentlich zugänglichen Daten aus dem Internet mit Lichtbildern 
und Stimmen von Tatverdächtigen und anderen gesuchten Personen auf eine rechtssichere Grundlage stellt. 
II. Wesentlicher Inhalt des Entwurfs 
Für den biometrischen Internetabgleich, die automatisierte Datenanalyse und BKA-Anfragen bei Banken sollen 
neue Befugnisse geschaffen werden:  
Die Befugnis zum biometrischen Abgleich von öffentlich zugänglichen Daten aus dem Internet dient dem Zweck, 
dass die Strafverfolgungsbehörden zu Strafverfolgungszwecken sowie das Bundeskriminalamt und die
Bundespolizei für weitere (polizeiliche) Aufgaben biometrische Daten zu Gesichtern und Stimmen mittels automatisierter 
technischer Verfahren mit Internetdaten (z. B. soziale Medien), abgleichen können. Ziel ist es insbesondere,
mutmaßliche Terroristen und Tatverdächtige zu identifizieren und zu lokalisieren. So können beispielsweise
Lichtbilder einer Zielperson mit IS-Propagandavideos und Daten aus sozialen Medien abgeglichen werden, um
Hinweise auf die Person selbst sowie Mittäter oder Hintermänner zu erhalten.  
Digitalisierung führt dazu, dass Datenmengen grundsätzlich ansteigen und weiter ansteigen werden, sowie
zunehmend große Datenmengen ausgewertet werden müssen. Hierfür sollen Befugnisse zur automatisierten
Datenanalyse für Bundeskriminalamt und Bundespolizei geschaffen werden. Diese Befugnisse können dazu dienen, bei 
großen Datenmengen, Verbindungen/Beziehungen zwischen Informationen herzustellen. Die Polizeibehörden 
werden auf diese Weise in die Lage versetzt, bereits im polizeilichen Informationssystem oder im polizeilichen 
Informationsverbund vorhandene Informationen besser, schneller und effizienter auszuwerten. Damit
entsprechende IT- und KI-Systeme auch ordnungsgemäß getestet und trainiert werden, bedarf es zur Rechtssicherheit 
einer entsprechenden Rechtsgrundlage. 
Bei Ermittlungen des Bundeskriminalamts im Bereich der Terrorismusfinanzierung kann es erforderlich sein, 
polizeiliche Anfragen an geldwäscherechtlich Verpflichtete wie z. B. Banken zu stellen. Damit Banken in der 
